{
  "schema_version": "0.1",
  "dataset_id": "synthetic_correction_contract",
  "dataset_version": "fixture-v1",
  "synthetic_only": true,
  "description": "Entirely synthetic status fixtures. No photos, textbook content, student data, or actual model responses. Not performance evidence.",
  "samples": [
    {
      "sample_id": "synthetic_01",
      "question_group_id": "question_01",
      "capture_group_id": "capture_01",
      "split": "holdout",
      "stage": "initial",
      "parent_sample_id": null,
      "curriculum": {
        "stage": "junior_middle_school",
        "publisher": "PEP-context-only",
        "grade": 7,
        "term": "upper",
        "textbook_revision": null
      },
      "question_type": "linear_equation",
      "image_conditions": [
        "synthetic_no_image",
        "clear"
      ],
      "authorization": {
        "status": "synthetic",
        "basis_ref": "synthetic_fixture_authored_for_evaluator"
      },
      "asset_ref": null,
      "source_asset_sha256": null,
      "input_versions": {
        "question_id": "question_01",
        "question_revision": 1,
        "attempt_id": "attempt_01",
        "attempt_recognition_revision": 1,
        "fingerprint": "9c41a25d999dcb94906047efc594b257763b4e6b86a81afe58f2b218edaa54cf"
      },
      "label": {
        "status": "reviewed",
        "verdict": "correct",
        "basis_kind": "synthetic_fixture",
        "basis_ref": "fixture_arithmetic_case_01",
        "reviewer_id": "synthetic_author",
        "reviewer_role": "synthetic_fixture",
        "adjudication_ref": null
      }
    },
    {
      "sample_id": "synthetic_02",
      "question_group_id": "question_02",
      "capture_group_id": "capture_01",
      "split": "holdout",
      "stage": "initial",
      "parent_sample_id": null,
      "curriculum": {
        "stage": "junior_middle_school",
        "publisher": "PEP-context-only",
        "grade": 7,
        "term": "upper",
        "textbook_revision": null
      },
      "question_type": "linear_equation",
      "image_conditions": [
        "synthetic_no_image",
        "clear"
      ],
      "authorization": {
        "status": "synthetic",
        "basis_ref": "synthetic_fixture_authored_for_evaluator"
      },
      "asset_ref": null,
      "source_asset_sha256": null,
      "input_versions": {
        "question_id": "question_02",
        "question_revision": 1,
        "attempt_id": "attempt_02",
        "attempt_recognition_revision": 1,
        "fingerprint": "728ef474a74a4aa182e2b654a197cd0b0c75f29e2ad647f4f453c0fdfff275e6"
      },
      "label": {
        "status": "reviewed",
        "verdict": "correct",
        "basis_kind": "synthetic_fixture",
        "basis_ref": "fixture_arithmetic_case_02",
        "reviewer_id": "synthetic_author",
        "reviewer_role": "synthetic_fixture",
        "adjudication_ref": null
      }
    },
    {
      "sample_id": "synthetic_03",
      "question_group_id": "question_03",
      "capture_group_id": "capture_03",
      "split": "holdout",
      "stage": "initial",
      "parent_sample_id": null,
      "curriculum": {
        "stage": "junior_middle_school",
        "publisher": "PEP-context-only",
        "grade": 7,
        "term": "upper",
        "textbook_revision": null
      },
      "question_type": "linear_equation",
      "image_conditions": [
        "synthetic_no_image",
        "clear"
      ],
      "authorization": {
        "status": "synthetic",
        "basis_ref": "synthetic_fixture_authored_for_evaluator"
      },
      "asset_ref": null,
      "source_asset_sha256": null,
      "input_versions": {
        "question_id": "question_03",
        "question_revision": 1,
        "attempt_id": "attempt_03",
        "attempt_recognition_revision": 1,
        "fingerprint": "652621d14d3b66fb553db2fa67d73c7236d67c7a73235f4e8654822618581a2f"
      },
      "label": {
        "status": "reviewed",
        "verdict": "incorrect",
        "basis_kind": "synthetic_fixture",
        "basis_ref": "fixture_arithmetic_case_03",
        "reviewer_id": "synthetic_author",
        "reviewer_role": "synthetic_fixture",
        "adjudication_ref": null
      }
    },
    {
      "sample_id": "synthetic_04",
      "question_group_id": "question_04",
      "capture_group_id": "capture_04",
      "split": "holdout",
      "stage": "initial",
      "parent_sample_id": null,
      "curriculum": {
        "stage": "junior_middle_school",
        "publisher": "PEP-context-only",
        "grade": 7,
        "term": "upper",
        "textbook_revision": null
      },
      "question_type": "linear_equation",
      "image_conditions": [
        "synthetic_no_image",
        "clear"
      ],
      "authorization": {
        "status": "synthetic",
        "basis_ref": "synthetic_fixture_authored_for_evaluator"
      },
      "asset_ref": null,
      "source_asset_sha256": null,
      "input_versions": {
        "question_id": "question_04",
        "question_revision": 1,
        "attempt_id": "attempt_04",
        "attempt_recognition_revision": 1,
        "fingerprint": "44c13fbb00cc89909df60d2a2f9b82c2a7818591a646281d3f8a37f108120888"
      },
      "label": {
        "status": "reviewed",
        "verdict": "incorrect",
        "basis_kind": "synthetic_fixture",
        "basis_ref": "fixture_arithmetic_case_04",
        "reviewer_id": "synthetic_author",
        "reviewer_role": "synthetic_fixture",
        "adjudication_ref": null
      }
    },
    {
      "sample_id": "synthetic_05",
      "question_group_id": "question_05",
      "capture_group_id": "capture_05",
      "split": "holdout",
      "stage": "initial",
      "parent_sample_id": null,
      "curriculum": {
        "stage": "junior_middle_school",
        "publisher": "PEP-context-only",
        "grade": 7,
        "term": "upper",
        "textbook_revision": null
      },
      "question_type": "fraction",
      "image_conditions": [
        "synthetic_no_image",
        "blur"
      ],
      "authorization": {
        "status": "synthetic",
        "basis_ref": "synthetic_fixture_authored_for_evaluator"
      },
      "asset_ref": null,
      "source_asset_sha256": null,
      "input_versions": {
        "question_id": "question_05",
        "question_revision": 1,
        "attempt_id": "attempt_05",
        "attempt_recognition_revision": 1,
        "fingerprint": "b4e440a53f88444536130d3274a2fe74474cfaa20ae24aee070b32fbcebfa21b"
      },
      "label": {
        "status": "reviewed",
        "verdict": "incorrect",
        "basis_kind": "synthetic_fixture",
        "basis_ref": "fixture_arithmetic_case_05",
        "reviewer_id": "synthetic_author",
        "reviewer_role": "synthetic_fixture",
        "adjudication_ref": null
      }
    },
    {
      "sample_id": "synthetic_06",
      "question_group_id": "question_06",
      "capture_group_id": "capture_06",
      "split": "holdout",
      "stage": "initial",
      "parent_sample_id": null,
      "curriculum": {
        "stage": "junior_middle_school",
        "publisher": "PEP-context-only",
        "grade": 7,
        "term": "upper",
        "textbook_revision": null
      },
      "question_type": "geometry_proof",
      "image_conditions": [
        "synthetic_no_image",
        "missing_steps"
      ],
      "authorization": {
        "status": "synthetic",
        "basis_ref": "synthetic_fixture_authored_for_evaluator"
      },
      "asset_ref": null,
      "source_asset_sha256": null,
      "input_versions": {
        "question_id": "question_06",
        "question_revision": 1,
        "attempt_id": "attempt_06",
        "attempt_recognition_revision": 1,
        "fingerprint": "ed5ce0fb5047650994a069c612d6c4f2ae7c935359219b61d50ed553aa7fd94d"
      },
      "label": {
        "status": "reviewed",
        "verdict": "incorrect",
        "basis_kind": "synthetic_fixture",
        "basis_ref": "fixture_arithmetic_case_06",
        "reviewer_id": "synthetic_author",
        "reviewer_role": "synthetic_fixture",
        "adjudication_ref": null
      }
    },
    {
      "sample_id": "synthetic_07",
      "question_group_id": "question_07",
      "capture_group_id": "capture_07",
      "split": "holdout",
      "stage": "initial",
      "parent_sample_id": null,
      "curriculum": {
        "stage": "junior_middle_school",
        "publisher": "PEP-context-only",
        "grade": 7,
        "term": "upper",
        "textbook_revision": null
      },
      "question_type": "linear_equation",
      "image_conditions": [
        "synthetic_no_image",
        "clear"
      ],
      "authorization": {
        "status": "synthetic",
        "basis_ref": "synthetic_fixture_authored_for_evaluator"
      },
      "asset_ref": null,
      "source_asset_sha256": null,
      "input_versions": {
        "question_id": "question_07",
        "question_revision": 1,
        "attempt_id": "attempt_07",
        "attempt_recognition_revision": 1,
        "fingerprint": "64f036118684c0c4889138ece5347a0cd356ccd2d521ed020a9e17cfb70c7b5e"
      },
      "label": {
        "status": "reviewed",
        "verdict": "incorrect",
        "basis_kind": "synthetic_fixture",
        "basis_ref": "fixture_arithmetic_case_07",
        "reviewer_id": "synthetic_author",
        "reviewer_role": "synthetic_fixture",
        "adjudication_ref": null
      }
    },
    {
      "sample_id": "synthetic_08",
      "question_group_id": "question_08",
      "capture_group_id": "capture_08",
      "split": "holdout",
      "stage": "initial",
      "parent_sample_id": null,
      "curriculum": {
        "stage": "junior_middle_school",
        "publisher": "PEP-context-only",
        "grade": 7,
        "term": "upper",
        "textbook_revision": null
      },
      "question_type": "multi_part",
      "image_conditions": [
        "synthetic_no_image",
        "missed_segmentation"
      ],
      "authorization": {
        "status": "synthetic",